{
  "schema_version": "1.0",
  "issue_id": "SP-2023-Y",
  "batch_id": "batch-1385",
  "input_batch_sha256": "ad01ea8650edd5f297d644679401ce025b171aa5e739add0f05fcfce1fa03c4d",
  "prompt_id": "source-screening-v0.1",
  "prompt_sha256": "144de215ea7cd1225d2331541f4d09590e6fdea53599e259f98e029d7fa07bb7",
  "runner": {
    "provider": "OpenAI",
    "model": "GPT-5.6 Sol",
    "invocation": "ChatGPT interactive annual retrospective screening",
    "generated_at": "2026-08-16T14:10:00Z"
  },
  "decisions": [
    {
      "screening_id": "arxiv:2309.06847v2",
      "decision": "DROP",
      "reason": "Raw source is preserved in the complete annual intake but was not promoted after the 2023 annual coverage audit because it is not required to establish the material year-scale trajectories, chronology boundaries, or selected supporting research.",
      "why_now": null,
      "topic_lanes": [],
      "duplicate_group": null,
      "verification_targets": [],
      "confidence": "high"
    },
    {
      "screening_id": "arxiv:2309.06865v2",
      "decision": "DROP",
      "reason": "Raw source is preserved in the complete annual intake but was not promoted after the 2023 annual coverage audit because it is not required to establish the material year-scale trajectories, chronology boundaries, or selected supporting research.",
      "why_now": null,
      "topic_lanes": [],
      "duplicate_group": null,
      "verification_targets": [],
      "confidence": "high"
    },
    {
      "screening_id": "arxiv:2309.06867v2",
      "decision": "DROP",
      "reason": "Raw source is preserved in the complete annual intake but was not promoted after the 2023 annual coverage audit because it is not required to establish the material year-scale trajectories, chronology boundaries, or selected supporting research.",
      "why_now": null,
      "topic_lanes": [],
      "duplicate_group": null,
      "verification_targets": [],
      "confidence": "high"
    },
    {
      "screening_id": "arxiv:2309.06869v3",
      "decision": "DROP",
      "reason": "Raw source is preserved in the complete annual intake but was not promoted after the 2023 annual coverage audit because it is not required to establish the material year-scale trajectories, chronology boundaries, or selected supporting research.",
      "why_now": null,
      "topic_lanes": [],
      "duplicate_group": null,
      "verification_targets": [],
      "confidence": "high"
    },
    {
      "screening_id": "arxiv:2309.07192v1",
      "decision": "DROP",
      "reason": "Raw source is preserved in the complete annual intake but was not promoted after the 2023 annual coverage audit because it is not required to establish the material year-scale trajectories, chronology boundaries, or selected supporting research.",
      "why_now": null,
      "topic_lanes": [],
      "duplicate_group": null,
      "verification_targets": [],
      "confidence": "high"
    },
    {
      "screening_id": "arxiv:2309.07193v1",
      "decision": "DROP",
      "reason": "Raw source is preserved in the complete annual intake but was not promoted after the 2023 annual coverage audit because it is not required to establish the material year-scale trajectories, chronology boundaries, or selected supporting research.",
      "why_now": null,
      "topic_lanes": [],
      "duplicate_group": null,
      "verification_targets": [],
      "confidence": "high"
    },
    {
      "screening_id": "arxiv:2309.06877v1",
      "decision": "DROP",
      "reason": "Raw source is preserved in the complete annual intake but was not promoted after the 2023 annual coverage audit because it is not required to establish the material year-scale trajectories, chronology boundaries, or selected supporting research.",
      "why_now": null,
      "topic_lanes": [],
      "duplicate_group": null,
      "verification_targets": [],
      "confidence": "high"
    },
    {
      "screening_id": "arxiv:2309.06882v1",
      "decision": "DROP",
      "reason": "Raw source is preserved in the complete annual intake but was not promoted after the 2023 annual coverage audit because it is not required to establish the material year-scale trajectories, chronology boundaries, or selected supporting research.",
      "why_now": null,
      "topic_lanes": [],
      "duplicate_group": null,
      "verification_targets": [],
      "confidence": "high"
    },
    {
      "screening_id": "arxiv:2309.06884v2",
      "decision": "DROP",
      "reason": "Raw source is preserved in the complete annual intake but was not promoted after the 2023 annual coverage audit because it is not required to establish the material year-scale trajectories, chronology boundaries, or selected supporting research.",
      "why_now": null,
      "topic_lanes": [],
      "duplicate_group": null,
      "verification_targets": [],
      "confidence": "high"
    },
    {
      "screening_id": "arxiv:2309.06888v1",
      "decision": "DROP",
      "reason": "Raw source is preserved in the complete annual intake but was not promoted after the 2023 annual coverage audit because it is not required to establish the material year-scale trajectories, chronology boundaries, or selected supporting research.",
      "why_now": null,
      "topic_lanes": [],
      "duplicate_group": null,
      "verification_targets": [],
      "confidence": "high"
    },
    {
      "screening_id": "arxiv:2309.06891v1",
      "decision": "DROP",
      "reason": "Raw source is preserved in the complete annual intake but was not promoted after the 2023 annual coverage audit because it is not required to establish the material year-scale trajectories, chronology boundaries, or selected supporting research.",
      "why_now": null,
      "topic_lanes": [],
      "duplicate_group": null,
      "verification_targets": [],
      "confidence": "high"
    },
    {
      "screening_id": "arxiv:2309.06895v2",
      "decision": "DROP",
      "reason": "Raw source is preserved in the complete annual intake but was not promoted after the 2023 annual coverage audit because it is not required to establish the material year-scale trajectories, chronology boundaries, or selected supporting research.",
      "why_now": null,
      "topic_lanes": [],
      "duplicate_group": null,
      "verification_targets": [],
      "confidence": "high"
    },
    {
      "screening_id": "arxiv:2309.06896v1",
      "decision": "DROP",
      "reason": "Raw source is preserved in the complete annual intake but was not promoted after the 2023 annual coverage audit because it is not required to establish the material year-scale trajectories, chronology boundaries, or selected supporting research.",
      "why_now": null,
      "topic_lanes": [],
      "duplicate_group": null,
      "verification_targets": [],
      "confidence": "high"
    },
    {
      "screening_id": "arxiv:2309.06902v4",
      "decision": "DROP",
      "reason": "Raw source is preserved in the complete annual intake but was not promoted after the 2023 annual coverage audit because it is not required to establish the material year-scale trajectories, chronology boundaries, or selected supporting research.",
      "why_now": null,
      "topic_lanes": [],
      "duplicate_group": null,
      "verification_targets": [],
      "confidence": "high"
    },
    {
      "screening_id": "arxiv:2309.06908v2",
      "decision": "DROP",
      "reason": "Raw source is preserved in the complete annual intake but was not promoted after the 2023 annual coverage audit because it is not required to establish the material year-scale trajectories, chronology boundaries, or selected supporting research.",
      "why_now": null,
      "topic_lanes": [],
      "duplicate_group": null,
      "verification_targets": [],
      "confidence": "high"
    },
    {
      "screening_id": "arxiv:2309.06917v1",
      "decision": "DROP",
      "reason": "Raw source is preserved in the complete annual intake but was not promoted after the 2023 annual coverage audit because it is not required to establish the material year-scale trajectories, chronology boundaries, or selected supporting research.",
      "why_now": null,
      "topic_lanes": [],
      "duplicate_group": null,
      "verification_targets": [],
      "confidence": "high"
    },
    {
      "screening_id": "arxiv:2309.06918v1",
      "decision": "DROP",
      "reason": "Raw source is preserved in the complete annual intake but was not promoted after the 2023 annual coverage audit because it is not required to establish the material year-scale trajectories, chronology boundaries, or selected supporting research.",
      "why_now": null,
      "topic_lanes": [],
      "duplicate_group": null,
      "verification_targets": [],
      "confidence": "high"
    },
    {
      "screening_id": "arxiv:2309.06921v1",
      "decision": "DROP",
      "reason": "Raw source is preserved in the complete annual intake but was not promoted after the 2023 annual coverage audit because it is not required to establish the material year-scale trajectories, chronology boundaries, or selected supporting research.",
      "why_now": null,
      "topic_lanes": [],
      "duplicate_group": null,
      "verification_targets": [],
      "confidence": "high"
    },
    {
      "screening_id": "arxiv:2309.06922v1",
      "decision": "DROP",
      "reason": "Raw source is preserved in the complete annual intake but was not promoted after the 2023 annual coverage audit because it is not required to establish the material year-scale trajectories, chronology boundaries, or selected supporting research.",
      "why_now": null,
      "topic_lanes": [],
      "duplicate_group": null,
      "verification_targets": [],
      "confidence": "high"
    },
    {
      "screening_id": "arxiv:2309.06923v1",
      "decision": "DROP",